Title,Chabad House Name,When,Age Group,Description,Date,Start Time,End Time,Location,Zip Code,Website,Image URL
Megillah Reading,Chabad of Portland,Purim Night,All Ages,Join us for the evening Megillah reading with refreshments,March 13 2025,7:00 PM,8:00 PM,"1234 Main St, Portland, OR 97201",97201,https://example.com,
Morning Megillah & Breakfast,Chabad of Eugene,Purim Day,All Ages,Morning Megillah reading followed by a festive breakfast,March 14 2025,9:00 AM,10:30 AM,"5678 Oak Ave, Eugene, OR 97401",97401,https://example.com,
Kids Purim Party,Chabad of Salem,Pre-Purim,Kids,Costume parade and hamantaschen baking for children,March 12 2025,4:00 PM,6:00 PM,"910 State St, Salem, OR 97301",97301,https://example.com,
Megillah Reading,Chabad of Bend,Purim Night,All Ages,Evening Megillah reading,March 13 2025,7:30 PM,8:30 PM,"2468 Bond St, Bend, OR 97701",97701,https://example.com,
Purim Seudah,Chabad of Beaverton,Purim Day,Adults,Festive Purim meal with live music,March 14 2025,5:00 PM,8:00 PM,"3579 Canyon Rd, Beaverton, OR 97005",97005,https://example.com,
